,headline,actual_classification,logistic_regression_classification,xgboost_classification
2287,cboe global markets deutsche bank more bullish on google with new blockbusterad possibilities,0,1,0
3043,Here's What It Actually Costs to Spend 4 Days at Disneyland,1,1,1
18800,should you search on google or type url in a browser's address bar,1,1,1
25666,foam core materials market to witness robust expansion by 2024& top key players like corelitediabevonikinc,1,0,0
8036,carmen sandiego returns to google earth in tutankhamum's mask caper,1,1,1
13894,"warc effective 100 & lessons from this year's global annual effectiveness rankings the need for innovation in media strategies to drive attention the importance of brands to be instantly recognisable and blending brand and performance marketing are three main themes to longterm marketing effectiveness finds warc following its analysis of the effective 100 an annual ranking of campaigns based on their performance in effectiveness competitions from around the world warc which provides the latest evidence expertise and guidance to make marketers more effective has today released 'effective 100 & lessons from the global effectiveness rankings' a report analysis of the world's top effectiveness campaigns to uncover shared creative media and measurement strategies and brings together insights and opinion from industry experts says amy rodgers managing editor research and rankings warc and author of the report ""in this report we've brought together expert opinion and the data behind the case studies to ascertain the themes and lessons from the 2019 effective 100 through analysing yearonyear trends within the rankings and comparing the top cases with all other case studies published on warc in the same year we can establish what differentiates a highly awarded effective 100 campaign from a more 'typical' example of an effective marketing campaign"" the three key trends from this year's warc effective 100 are 1 effectiveness in a lowattention economy there is more competition for attention than ever before capturing the attention of consumers which has become a measure of campaign effectiveness now requires innovation in both creativity and media placement there are four key responses highlighted from analysing the effective 100 to achieve this 1 creativity and in particular the use of emotional appeals 59 of the campaigns in the ranking used this approach 2 the growing use of influencers & more than 20 of case studies in the effective 100 contained specific influencer elements 3 the use of prdriven stunts as a means to catch the attention of both consumers and the media is a recurring theme & as seen in fearless girl the mud soldier for visit flanders and google home of the whopper 4 a greater focus on unconventional media placement such as reaching people when they don't expect it as seen in india's newest status symbol for harpic says faris yakob founder of strategy and innovation consultancy genius steals ""this year's warc's effective 100 suggests that the most effective ads all over the world don't look like ads if you don't trust ads which live trapped in media a way for brands to overcome this is by making real things"" saregama's carvaan and savlon's soap sticks are some of the examples yakob cites 2 distinctive assets and the importance of being recognised distinctive brand assets are emerging as a key weapon of effective campaigns the importance of being recognisable is evident in this year's effective 100 with the development of brand equity a central objective and measure of many of the campaigns success stories in the effective 100 include 'kevin the carrot how aldi uk won christmas with the help of a humble carrot' ranked 25 the 'made for more' campaign for guinness ranked 31 and 'the door blouse' campaign in india for narayana health ranked 20 says heather andrew uk ceo neuroinsight ""nowadays many brands are developing and codifying a wider set of distinctive assets that can be transferred across platforms as a way of delivering instant recognition ""in terms of brain response this makes complete sense in brand communication memory response is crucial & if something doesn't get into memory it can't possibly affect our future behaviour & and one of the crucial characteristics of memory is that it works by association"" 3 balancing brand building and performance brandbuilding and performance marketing are often distinct activities but pressure is growing to integrate the two with teams working together for mutual benefit examples of campaigns in the effective 100 that have successfully combined measuring 'brand' in a more datadriven way and enhancing performance through cohesive narratives include 'beauty and brains for aldi ranked 8 and ikea's 'the wonderful everyday43 says dan hagen global chief strategy officer iprospect ""in the mad rush of today's world we rarely spend enough time and effort really diagnosing the problem we have before we jump to solutions"" hagen adds ""we need to think of it like a threelegged race rather than a relay it is about different talents working in tandem and the collision of those specialism will drive a different level of performance"" a summary of warc's lessons from the global effectiveness rankings can be downloaded here the full report is available to warc subscribers and includes indepth study of the three themes with commentary from industry experts a spotlight on carvaan for saregama the top ranked campaign data analysis behind the winning campaigns and expert commentary across the results of the effective 100 the warc effective 100 formerly the warc 100 is an annual ranking of the world's top campaigns and companies for effectiveness based on the results of effectiveness competitions it forms part of warc rankings successor to the gunn report which track the winners' lists from all the most important advertising award contests globally",0,0,0
19408,jeff bezos amazon founder unveils blue moon lander concept,1,1,1
12886,carmen sandiego returns to google earth in new recreation,1,1,1
3478,There’s just one thing wrong with the new Nissan Leaf,1,1,1
13186,save 41 on google home mini,1,1,1
2199,Jennifer Aniston shares sweet story of the Friends cast's pre-fame Las Vegas trip,1,1,1
13936,heres how you can book train tickets on mobile via google pay,1,1,1
25382,rapid product launches better deals can help smaller firms compete with amazon expert says,1,1,1
2806,REUTERS NEWS SCHEDULE AT 0600 GMT/0200 ET,1,1,1
25991,amazon helps deliveroo expand its delivery reach,1,1,1
1024,Silicon Valley Pressured as Washington Turns Up Antitrust Heat,0,1,1
2268,Spotify's New Trick Won't Hurt Sirius XM's Pandora,1,1,1
1719,UPDATE 1-Amazon says new drone to take flight for package delivery in months,1,1,1
1996,google michigan businesses generate more than 6 billion in economic impact,1,1,1
19869,evonik reorganizing pa and quitting ppa,1,1,1
2593,"Vice Media Lays Off Two Top Editors, Sets New Hires And Promotions As Revamp Continues",1,1,1
6938,northeast tennessee will be shown to the world on amazon series awol,1,1,1
26429,google made fun of apple in new commercial video,1,1,1
2192,"Apple Recalls 814,000 Overseas AC Adapters Over Shock Hazard",1,1,1
972,score exclusive deals for the new google pixel 3a in singapore this weekend,1,1,1
13171,upgraded google assistant gets faster and smarter video cnet,1,1,1
2178,Exclusive: Foxconn plans management overhaul as Chairman Gou seeks Taiwan presidency - source,1,1,1
3300,FACTBOX-Global tech companies shun Huawei after U.S. ban,1,1,1
26067,google pixel 3a vs pixel 3 how does the 400 phone stack up,1,1,1
2435,Scouted: The 5 Best Smart Speakers That Combine Smart Home Capabilities With Stylish Design,1,1,1
13223,5 new features of google maps that travelers will love,1,1,1
7173,google looking to make foldable technology phones,1,1,1
13333,amazon india u00e2u0080u0094 i do not know,1,1,1
2899,"Jenni 'JWoww' Farley Says Her Kids Have 'Always Known' Her Boyfriend, Zack Clayton Carpinello",1,1,1
828,"The Zacks Analyst Blog Highlights: Disney, Coca-Cola, Gilead, CME and Entergy",0,1,1
8359,calcutta university to collaborate with google scholar to boost nirf ranking,1,1,1
18827,airtel infinity postpaid plan customers to get amazon prime membership,1,1,1
12620,google ai is still heavily supported by actual humans,1,1,1
13484,local school receives boost from amazon following vandalism,1,1,1
13450,google maps street view man shocks with outrageous behaviour & what is he doing,1,1,1
6908,amazon takes bite of deliveroo in u00c2u00a3450 million funding round,1,1,1
3726,"Trump Tariff Vow Roils Markets, Autos as Mexico Urges Talks",1,0,0
7224,google to start charging european phone makers for using its app suite,1,1,1
1773,Pokemon Sword and Shield for Nintendo Switch finally have a release date – preorder both right here,1,1,1
3454,Fiat Chrysler in tie-up talks with Renault - sources,1,1,1
1395,how to use google maps to help someone find you share your realtime location,1,1,1
1531,jeff bezos reportedly had bulletproof panels installed in his office as part of his 16 million amazon security operation,1,1,1
2095,amazon alexa transcripts live on even after you delete voice records,1,1,1
7909,datalex appoints former google finance director as new cfo,1,1,1
13873,the fantastic way you can see hull like youve never seen it before the maritime museum wilberforce house ferens art gallery trinity house and the holy trinity church are but a few pieces of architecture that hark back to times gone by but what if you could see what hull used to look like before it was battered by the blitz in the second world war it is almost 75 years since the war ended with 95 per cent of hulls houses being hit and tragically more than 1200 people being killed destroying the way the city used to look now though thanks to the use of technology the history of hull has been brought to life on a special tour through the use of digital technology mike covell who runs amazing hull tours is able to show the public images of old hull while standing in the same spot meaning you can see hull in a way few have seen before the historian specialises in over 49 tours including ww2 hull blitz tours and ghost walks his true crime tours are a huge hit discussing grisly topics like the silver hatchet gang the caughey street murder and the infamous beverley road bum stabber he even has a jack the ripper tour which explores 14 suspects with links to hull plus a number of ripper scares and a ripper letter sent to the hull press in october 1888 but if crime isnt your thing there are other tours as well from lost pubs to lost cinema victorian architecture hull heroes ballad tours jewish tours and a black history tour the tours are for everyone including schools colleges and the university of hull in which mike showcases the history culture and art of hull to all the international students who come to the city he gave hull live reporter anna riley a bespoke tour of the city showing the centre in a way that it has never been seen before hammonds we started in the spot where house of fraser is now at paragon station in hull city centre and where hammonds used to stand before it was bombed in 1941 mike held up his ipad with an image of how the department store used to look for comparison the deadly german air raids in may 1941 gutted the building but within weeks 47 departments had reopened in temporary locations and carried on with the business for the rest of the war many staff from hammonds still came to work the next day and carried on their duties as normal after bombing had destroyed the department store which really shows true grit said mike when peace came plans for a new store were drawn up and the new building eventually opened on the same site in may 1952 in hull 1200 civilians died during the bombings and the peoples memorial now next to house of fraser commemorates this maritime museum the magnificent victorian building which is home to the maritime museum was one of the few buildings in victoria square that remained unscathed during the bombings in hull opening as hulls dock offices in 1871 the building stood the test of time and was transformed into a museum in the mid1970s while housing some incredible and fascinating artefacts the city centre museum has remained much the same for the past 40 years but this could soon change as hull city council hope to win a heritage lottery fund bid for millions of pounds as part of hull yorkshire maritime city project if successful it will turn the museum into a bigger and brighter attraction with better access to showcase hulls rich maritime past mike provided a 360 degree view of pictures showing how the area used to look around the maritime museum lots of buildings were bombed near to the maritime museum during the war he told me near where barclays stands now used to be rows of houses where a large population lived many of these homes were decimated during the blitz and the whole area had to be rebuilt from scratch looking at the buildings not just here but all around the city centre you can tell where they have been rebuilt as often they are modern in contrast to the older prewar buildings or they have modern additions to the tops of older buildings which looks out of place beverley gate beverley gate near to whitefriargate is another spot in hull that is steeped in history it is the spot where king charles was famously refused entry to hull by sir john hotham in 1642 an act of defiance widely acknowledged as the spark that ignited the english civil war remains of the walls which included a number of gated entrances were originally uncovered during an archaeological excavation in the late 1980s the important site was then given a makeover in july 2017 as part of the public realm programme in the city centre for uk city of culture an actual stone arch used to be in place at the entrance to whitefriargate and this was later replaced by wood to show how it used to look while standing next to the excavated spot mike showed an image of the wooden structure looking every bit medieval with a horse and cart coming through the entrance to the thoroughfare the wooden structure collapsed in time and had to be dismantled but it certainly shows an impressive and grand entrance way to whitefriargate reminiscent of similar structures in cities like york whitefriargate whitefriargate is filled with buildings that echo past times and many shops now down there have a story to tell whitefriargate used to be the bustling hub of hull for shopping said mike showing a black and white picture of woolworths bustling with activity while we were stood outside the now closed marks & spencer i like to take people down here on a night when its less busy as in the evening it is easier to look up more and have time to appreciate the buildings and view just how detailed they are like the chimneys and windows that are so detailed most buildings have a story attached to them down here u00a0 louis carrolls grandfather had links to the boots that used to be here which is now the works building there used to be an old workhouse near hmv and frederick bailey a bigamist defrauded the bank that used to operate here it is amazing what you can find when you delve a bit deeper whitefriargate for example gets its name as bones were uncovered here of old friars mike even spotted a picture of himself in whitefriargate which he was placed in to honour his work during the hull city of culture 2017 ive always lived history and had a passion for local history that i got from dad he said pointing it out hull minster hull minster has 700 years of history and is as old as hull itselfu00a0since the 1300s the church has been a constant presence in the city centre and survived both zeppelin raids and nazi bombings during the first and second world wars the church was holy trinity church until it was given minster status in may 2017 and the grade i listed building is the largest parish church in england by floor area the place has strong connections to great people like andrew marvell and william wilberforce stained glass windows of national significance the minster used to be surrounded in fencing but now stands proud and open to all in the heart of the city centre market place market place where the king billy statue resides near the disused art nouveau gents toilets has links to gin the impressive gilded statue of king william iii was erected in 1734 in honour of william of orange & who has the distinction of introducing england to gin which he brought from his native holland and he even has his own pub named after him in hull with the toilets nearby holding an amusing story with mike revealing that goldfish used to swim about in the gents hulls amazing history throughout the tour mike was clearly proud of hull and its history and explained why he thought it was such a great city we have an amazing city and need to showcase it he said the wonderful architecture dating back to the 1700s and before that we still have in hull is a real jewel in historys crown the rich history that we have here from banishing charles 1 to the wars and william wilberforce as well as the current history we have with how hull is changing all the time is impressive all the quirks here are great too like our cream telephone boxes intricate windows street furniture memorials and plaques for people to discover i also think the ghost stories of the city are amazing like the reported hauntings in the old white heart and ye old black boy its facinating amazing hull tours has been going since 2013 with new tours costing between u00c2u00a34 and u00c2u00a35 being added every year anyone who would like to book a tour can do so on the amazing hull tours facebook page here follow hull live our daily newsletter to get the latest headlines direct to your email inbox every day click here download our app you can download our free app for iphone and ipad from applesu00a0appu00a0store or get the android version from google play follow us on instagram on the hull live instagram page we share gorgeous pictures of our stunning city and if you tag us in your posts we could repost your picture on our page we also put the latest news in our instagram stories click here to follow hull live on instagram source httpswwwhulldailymailcoukwhatsonwhatsonnewsfantasticwayyoucansee2912161,0,0,0
8199,magento integrates google shopping advertising solution,1,1,1
26278,google ads promote firms charging extra for services this article published by,1,1,1
1896,the awesome google home max smart is u00c2u00a3100 off right now,1,1,1
26304,lg starts rolling out amazon alexa on its 2019 tvs,1,1,1
25127,quantum technologies conference on 15th july includes google ibm microsoft airbus,1,1,1
6849,google unveils new pixel phones nest hub max,1,1,1
1368,Auto group tries to steer Colorado clear of California ZEV rules,0,1,1
2747,56 new Netflix original shows and movies will premiere in June – here’s the complete list,1,1,1
7760,amazon to pay workers to start their own delivery businesses,1,1,1
13609,buffetts berkshire unveils 861 mln amazon stake,1,1,1
7336,amazon expands its incar delivery service to include ford and lincoln so drivers can drop off packages to your parked vehicle,0,1,1
25957,google pay is coming to new york's mta,1,1,1
282,"Steve Aoki, Meg Donnelly, Fetty Wap and More to Perform at ARDYs: A Radio Disney Music Celebration (Exclusive)",0,1,1
19880,amazon prime video now launched in india,1,1,1
20215,this philips hue deal is an early amazon prime day beater,1,1,1
1588,fight for amazon domain pits south american countries against tech giant,1,1,1
217,Canadian smartphone-maker Siyata Mobile sees billions in U.S. market,0,1,1
13123,the most obscure and wild projectsproducts found on kickstarter and amazon may 2019 edition,1,1,1
25680,sennheiser noisecanceling headphones on salesave 115 at amazon,1,1,1
12628,google will add u0091autodelete option to location history feature,1,1,1
7933,informatica and google join forces on cloud data management,1,1,1
25200,tech news & a new google play store feature could save storage on your android phone,1,1,1
1876,Woody Allen to begin shooting new film starring Christoph Waltz,1,1,1
20531,amazon music unlimited is giving new listeners three months of unlimited jams for free,1,1,1
1328,latest google ar tech might be a wakeup call for marketers,0,1,1
7810,amazon summer sale offers and deals,1,1,1
2627,"Advncr Expands to U.S. With Video Game Industry Vets Wade Beckett, Blair Herter",1,1,1
12835,google search field in android is abused by scammers & digital life,1,1,1
24636,appeal over hitandrun incident in which cyclist sustained serious injuries near heuston station facebook twitter google,0,0,0
19615,uk's next and italy's giunti partner with amazon click and collect service,1,1,1
2037,Honeywell Unveils Enterprise Performance Management Solution,1,1,1
2079,Global Banks to Pay $91M in Settlement for FX Manipulation,1,1,1
8249,coillte wants memorial to claneborn us soldier removed from donadea forest park facebook twitter google,0,0,0
398,A Lot Of Pressure For 3M Stock,0,0,0
1458,tesla put tsla holder hotchkis & wiley capital management upped position by 780000 as stock price declined roosevelt investment group has trimmed its amazon com amzn position by 199 million as share value rose,0,0,0
1063,northwest vista college becomes first amazon web services academy in south central texas,1,1,1
3227,"Flip Phone Challenge: Frontier Pays $1,000 to Briefly Ditch Smartphone",1,1,1
6972,google brain nasfpn outperforms sota models for object detection,1,1,1
1483,google has not yet given up on the name of android q desserts,1,1,1
25711,all google play store ratings are about to be recalculated,1,1,1
13892,suzie miller solutions architect at amazon web services and chair of amazon's people with disabilities employee affinity group understands amazon's accessible and inclusive design is not just the right thing to do it's also good for business,1,1,1
1274,correctedofficialgoogle to show ads on homepage of app,1,1,1
14362,amazon canada nvidia shield with remote amazon warehouse used warm 18089,1,1,1
1867,‘Sneaky Pete’ Canceled After Three Seasons at Amazon,1,1,1
2272,"CORRECTED-Play the game, save the planet: Conservationists target video gamers",1,1,1
18490,boots bosses claim they can offer a winning formula in the us despite high street gloom and the threat from amazon,0,1,1
25878,overregulating google and facebook will hand 'the world leadership in tech' to china says exfacebook board member,1,1,1
7572,google updates android jetpack unveils jetpack compose,1,1,1
1108,artificial intelligence ai in bfsi market 2019 & google inc microsoft corporation amazon web services inc ibm corporation avaamo inc,0,0,0
3852,A Fiat Chrysler-Renault Merger Would Put Nissan in a Bind,1,1,1
6618,there's a toprated fast wireless charger on amazon today for 999 & bgr,0,1,1
25203,if the key to business success is focus why does amazon work,1,1,1
8269,you can now buy flight tickets on amazon in india,1,1,1
480,google pixel 3a pixel 3a xl price specifications key features colours ahead of may 7 launch,1,1,1
3842,This 1973 Jeep Commando Is Like A Time Capsule,1,1,1
1309,9 Things That Increase Your Car’s Value,0,0,0
19693,google might take the fight to cookie tracking at io 2019,1,1,1
12803,amazon canada lg 554k uhd hdr led tv with webos 40 548 wfs also at other retailers,1,1,1
18561,google io news and dates revealed & new smartphone and home gadgets coming,1,1,1
25264,amazon can continue selling facial analysis tech to the government,1,1,1
2801,Disney CEO says it will be 'difficult' to film in Georgia if abortion law takes effect,1,1,1
214,Stock - Wall Street Surges on Powell's Promises,0,0,0
14428,amazon canada ecobee 4 thermostat 269 reg 32900,1,1,1
1557,how to force google to delete info it has on you contact wnd,1,1,1
3220,Google flags U.S. national security risks from Huawei ban - FT,1,1,1
2045,Boeing (BA) Secures $41M Navy Deal to Modify P-8A Aircraft,1,1,1
18965,google adds the pixel 3a to its android enterprise recommended program,1,1,1
1841,"We are “very close” to peak fintech, with more than 10,000 startups jumping into the boom",1,1,1
14247,usmarkt beyond meat restaurant brands amazon berkshire hathaway tesla activision blizzard expedia,1,1,1
1585,Google Plans One of Its Biggest Acquisitions Ever in Bid to Bolster Its Cloud Business,1,1,1
768,amazon and american express slash credit card reward bonuses for joiners and spenders,1,1,1
13998,official nintendobranded star microsd card available on amazon uk,1,1,1
6784,google didn't investigate leaks that revealed dragonfly exec misconduct more,1,1,1
2817,"Christy Carlson Romano Reveals Past Struggle With Depression, Drinking, Self-Harm",1,1,1
25068,jonas brothers documentary 'chasing happiness' premiere date set on amazon prime video,1,1,1
22,"Zacks Value Trader Highlights: Xcel Brands, Williams-Sonoma, J.Jill, Macy's and Bed Bath &amp; Beyond",0,0,1
18991,latest research on digital media market 2019 comprehensive study by key players amazoncom apple inc google facebook sony corporation microsoft corporation,0,0,0
13578,google duo now has data saving group calls for android,1,1,1
82,International Flavors &amp; Fragrances Buys 50% Stake in Wiberg,0,1,1
18549,google wanted you to be bored at its latest developer conference u00e2u0080u0094 and it worked goog googl fb,1,1,1
195,When stocks scream sell — here's how to survive a meltdown,0,0,0
1436,M-Sport wants Tanak back from Toyota,0,1,1
1140,Winton Supercars: McLaughlin dominates Sunday race,0,0,1
24613,global selfdriving cars market key players 2019 google ford motor volvo group and tesla motors,0,1,0
24830,google discover feed set to get ads later this year,1,1,1
2061,Outlook for Electronics Semiconductors Industry Looks Bright,1,1,1
