,headline,actual_classification,logistic_regression_classification,xgboost_classification
2305,apex nc google reputation management negative post removal services launched,1,1,1
284,"Gambling Stock Roundup: WYNN to Sell Massachusetts Casino, DIS &amp; CZR Ink Deal",0,0,0
814,World shares skid after technology sell-off hits Nasdaq,0,1,1
13079,star trek picardis coming to amazon prime in ireland and the uk,1,1,1
1570,amazon canada silicon power 512gb 3d nand sata iii internal ssd 6999,1,1,1
2348,google may have finally made a truly usable voice assistant,1,1,1
12491,amazon summer sale 2019 tvs from xiaomi samsung and others starting rs 8990,0,1,1
12962,google expands its flutter mobile app sdk previously focused on android and ios to the web desktop and embedded devices emil protalinskiventurebeat,1,1,1
442,google announces major android auto update with new design,1,1,1
12776,evonik evolve to collaborate on 3d printing materials,1,1,1
281,4 New Stock Picks From Seth Klarman,0,0,0
822,reputationcom adds google services to its suite for enterprise reputation management,1,1,1
13766,record sales for canadian businesses through amazon,1,1,1
3730,Heineken Cuts Ties With Fresno Grizzlies Over Alexandria Ocasio-Cortez Video,1,1,1
18992,our favourite toaster oven is on sale lately at amazon & cnet,1,1,1
3933,"Samsung's Galaxy Fold won't launch in June, reports claim ",1,1,1
8238,our editors tested these 6 cleaning products on amazon u00e2u0080u0094 read their stellar feedback,1,1,1
1517,google assistant can tell apps to order food or track your run & engadget,1,1,1
14103,out of 650 million users online 70 will be video audience by 2020 google report,1,1,1
8390,google to rank new websites on search based on their mobile versions,1,1,1
518,A Jobs Report for Recession-Watchers: CEO Daily,1,1,1
7351,google automatically delete location history and activity data,1,1,1
1377,its the fastest wireless smartphone charger on amazon and its 30 today,1,1,1
26009,amazon india u00e2u0080u0094 supporting the seller and ignoring customers reviews intentionally,1,1,1
1741,"Amazon's new delivery drone, Trump in the U.K., Bezos' crib: NBC News Briefly",1,1,1
1785,Amazon One-Day Delivery Service to Boost E-commerce Momentum,1,1,1
3896,"BASF: Tightening capacity, higher costs create perfect storm for auto cat recycling ",1,1,1
2738,"Star Wars: Galaxy’s Edge Getting Less Far, Far Away For Opening-Day Visitors At Disneyland",1,1,1
6755,franks redhot original cayenne pepper hot sauce 5 fl oz 125 or less with samps and coupon amazon,1,1,1
19099,google adds pixel 3a to list of enterpriseready android phones,1,1,1
1332,8 ways google plans to tackle security and privacy in 2019,1,1,1
14214,google play store now suggesting users to uninstall unused apps,1,1,1
1863,‘Comfortable’ and ‘perfect’: Why men are obsessed with these $18 best-selling swim trunks,1,1,1
20423,google io we break down the highlights and lowlights the 359 ep 557,1,1,1
25253,future prospect of mobile cloud market 2019 with growth and industry overview and key players amazon microsoft google salesforce apple rackspace emc ibm oracle,1,0,0
25769,online sales climb in the uk europe 500 database walmart considers an ipo for uk grocer asda amazon launches clickandcollect with ukbased apparel retailer next uk and canadian retail sales get a boost debenhams lenders take over the 241yearold uk departmentstore chain,1,1,1
24673,google will pay owners of faulty pixel phones,1,1,1
1445,"Coil Coating Additives Market 2019 SWOT Analysis by Players: Evonik Industries, BYK, Elementis PLC, DOW ",0,0,1
1524,Every Marvel Cinematic Universe movie will be released in 4K,1,1,1
12535,32 current and former employees on the cultural shift inside google and the decline in trust and communication between the rank and file and the management beth kowittfortune,1,1,1
1234,google glass enterprise edition 2 introduced priced at 999,1,1,1
3276,Miley Cyrus sings reworked Nine Inch Nails songs in Black Mirror Series 5,1,1,1
24536,the unmissable fleabag returns on amazon prime video but approach with caution,1,1,1
979,Listen: A special episode from the halls of the ASCO meeting,0,1,1
25870,google pixel 3a review the best non iphone 649 you'll ever spend,1,1,1
555,15 Best Tech Gifts for Dads on Fatherrsquo;s Day,1,1,1
25935,google ai can now predict lung cancer accurately,1,1,1
7975,update should be fixed google pay is broken for many in android q beta 3,1,1,1
25387,instant pot duo mini is on sale for less than 50 at amazon,1,1,1
1908,This brilliant free app tells you if it’s cheaper to take Uber or Lyft,1,1,1
1260,Village councilor in Manila shot dead in capital’s Tondo district,0,1,1
6816,google announces incognito mode for maps,1,1,1
2770,UPDATE 4-Major Hollywood studios may reconsider Georgia business over abortion law,1,1,1
12751,huawei accuses us of bullying as it fights back against google ban,1,1,1
20307,google will almost give you a pixel 3a in exchange for your iphone,1,1,1
1238,Hemric tops opening Charlotte Coca-Cola 600 practice,0,1,1
6476,handsfree home appliances with voice recognition market 2019 top leading comapanies lg apple google samsung ge appliances,0,1,0
8180,new report on bitcoin technology market indepth analysis progress prospects business summary and growth rate by 2026 along with top key players such as top key players bitcointravel amazon bitcoinshop wordpress honest brew,0,0,0
20134,google assistant will soon be able to trigger routines,1,1,1
25227,flipkart teasing google pixel 3a and 3a xl launch expected on may 8th,1,1,1
1553,amazon unveils american sign language logo to support hardofhearing employees,1,1,1
12873,mac browser shootout microsoft edge vs apple safari vs google chrome vs mozilla's firefox,0,1,1
20228,italy opens antitrust probe into google because of a rejected android auto app,1,1,1
419,"Dell XPS Desktop, PlayStation 4 Pro, PlayStation Plus, iPad Pro, and more for June 8",0,1,1
20590,amazon is working on device to read human emotions report,1,1,1
2094,AT&amp;T eyes $16-$17-a-month streaming service: WSJ,1,1,1
24573,what's really going on with these amazon and google gadget 'experiments' & gizmodo uk,1,1,1
7545,amazon is slowly growing its fleet of stores but you cant return all online purchases there,1,1,1
24717,how to shop on amazon prime day 2019 u00e2u0080u0094 all the tips and tricks you need to save the most amount of money possible,1,1,1
19754,best deals on patio furniture at amazon and walmart,1,1,1
8404,lok sabha election results 2019 google showing indian elections across search assistant and youtube,1,1,1
1537,robots are coming for 1300 amazon warehouse jobs,1,1,1
824,find the perfect gift for dad this father's day with amazon,1,1,1
18747,google confirms ai based flood forecasting will be available in india ahead of monsoons,1,1,1
14218,steven levy google search results overrates freshness as a ranking signal,1,1,1
13414,google announces 10 new innovations for ads to help drive results & highlights from google marketing live 2019,1,1,1
1745,"Haven wants to help ‘the American public get better health and reduce the costs,’ JPMorgan CEO says",1,1,1
260,There’s No Price Low Enough for Disney+ to Threaten Netflix Stock,0,0,0
25529,google infrastructure update right now,1,1,1
2131,Best Backup Batteries &amp; Powerbanks For Refueling Phones &amp; Tablets,1,1,1
24982,data sheetu00e2u0080u0094a look inside the employee rebellion at google,1,1,1
20153,google will never sell any personal info to third parties' says sundar pichai,1,1,1
2383,How do you take olanzapine?,1,1,1
26154,galaxy note 9 and galaxy note 8 price crash in ultimate amazon offer,1,1,1
38,Stocks - S&amp;P 500 Makes a Late Surge as Trade Tensions Ease,0,0,0
25344,warren buffett and charlie munger ashamedof not buying google shares,1,1,1
12794,google ceo says 'work on privacy and security is never done' as company adds privacy features to key products,1,1,1
2253,here are the first genderneutral emojis from google androidpit just now,1,1,1
7755,amazon shareholders vote down limits on facial recognition software,1,1,1
2927,"Teens, superheroes lead charge in LGBTQ Hollywood movie characters",1,1,1
911,gadget guard amazon turns your alexa into security 'watchdog' that spies on your home & and sends you audio clips of intruders,1,1,1
12955,even without amazon long island city is attracting major businesses,1,1,1
1025,US gears up for antitrust battles with Big Tech,0,1,1
395,"Stocks making the biggest moves premarket: Office Depot, Lyft, Wendy's, TripAdvisor, Toyota &amp; more",0,1,0
2586,Miley Cyrus Speaks Out After She's Forcibly Grabbed and Kissed by Man in Barcelona,1,1,1
26004,google employees will sitin to protest retaliation culture,1,1,1
20031,how to win customers with google discover,1,1,1
20304,bcusgoogleeventthe 1112,1,1,1
6507,what google has learned about remote work six tips,1,1,1
24801,uber's ceo sent an email to employees addressing its disastrous ipo drawing on amazon and facebook's rough starts,0,0,1
2455,Ancient saber-toothed cats could crush a skull with their teeth,1,1,1
6915,google photos free unlimited storage for pixel smartphones you must pay attention to it,1,1,1
13662,rapper ice t nearly shotan amazon delivery driver,1,1,1
26319,amazon wins patent for proofofwork cryptographic system,1,1,1
1655,A $2.6B takeover of Looker shows Google's head is in the cloud,1,1,1
7617,crest gum detoxify & stock up on amazon,1,1,0
3684,Last-lap pass gives Custer dramatic Xfinity win at Pocono,1,1,1
19863,buffett's berkshire unveils 861m amazon stake,0,1,1
930,Get a Good Last-Minute Travel Deal,0,1,1
19128,google reverses decision to cut ties with huawei,1,1,1
788,amazon pits warehouse workers against each other in gaming challenge at 5 warehouses,1,1,1
553,Why Upwork Scratched College Degree Requirements From Our Job Descriptions,1,1,1
12867,delegates of amazon employees compare notes,1,1,1
6863,pasadenas red hen press selected for amazon literary partnership grant,1,1,1
2110,amazon web services announces intent to launch third availability zone in aws asia pacific,1,1,1
24521,quantum computing market competitive analysis 2027 cambridge quantum computing ltd dwave systems google ibm intel corporation microsoft and qxbranch,1,0,0
7356,how to enable dark mode in google maps on iphone & android u00c2u00absmartphones gadget hacks,1,1,1
1369,state bank of india sbi u00e2u0080u0094 amazon online refund issue,1,1,1
13634,google assistant can now u00e2u0080u00a6 settle your debts,1,1,1
8345,all the cool kids own these 40 products you can get on amazon,1,1,1
20284,snap a photo of a menu and google lens can tell you what to order,1,1,1
3742,Fraught Franco-Italian relations a roadblock risk for Renault-FCA,1,1,1
893,Liam Gallagher returns with new song “Shockwave”: Stream,0,1,1
24656,mayor de blasio new yorkers 'jaded' by amazon,1,1,1
917,Domo Inc (DOMO) Q1 2020 Earnings Call Transcript,0,0,0
233,"‘Secret Life Of Pets 2’ Seeing $47M+, But ‘Dark Phoenix’ Up In Smoke With $36M+ In Lowest Opening For ‘X-Men’ Movie",0,1,1
20564,talented local sculptor to showcase work in exhibition at kildare town heritage centre this thursday facebook twitter google,0,0,0
1697,"At Amazon event, Robert Downey Jr. reveals plan to use 'robotics' and other tech to clean up earth",1,1,1
6744,amazon com amzn holder sigma investment counselors raised position as ipg photonics group ipgp shares rose holder alecta pensionsforsakring omsesidigt upped holding,1,1,1
24980,amazon pledges to crack down on toxic children's school supplies,1,1,1
7098,google is monitoring your purchases by means of gmail & newpaper24,1,1,1
1815,alexa and google enabled smart plugs are just 750 each in this amazon sale & bgr,1,1,1
772,burger king to use gps and google traffic data to sell more burgers,1,1,1
1731,jobs at google india that you must explore,1,1,1
25009,google gets up to speed android q will support widecolor gamuts natively,1,1,1
2731,It feels so real: The force is strong at Disneyland's Star Wars: Galaxy's Edge,1,1,1
8253,netflix vs hbo now vs amazon prime video,0,0,1
6521,global plastic additives market outlook 20192024 with basf exxonmobil evonik industries dowdupont and nouryon dominating researchandmarketscom,1,0,1
1221,Trump to Delay Japan Trade Deal Until Country's July Polls,0,1,1
24593,cbs sells next star trek series to amazon prime,1,1,1
2258,New Apple sign-ins may present issues for Facebook,1,0,1
1256,lost dog with lame leg wandering around newbridge facebook twitter google,1,0,0
13835,amazon targets uber eats with major deliveroo investment,1,1,1
616,google io 2019 all of the big news announcements and more & the verge,0,1,1
2901,China Box Office: ‘Aladdin’ Opens on Top With $19 Million Weekend,1,1,1
2243,How Marijuana Legalization in Illinois Opens Up a Billion-Dollar Market,1,0,0
12992,future growth of cloud infrastructure as a service iaas market by new business developments innovations and top companies amazon data services apollo netmagic solutions etc,1,0,0
3274,"YouTube Bans Supremacist Content, Including Neo-Nazi and Holocaust Denial Videos",1,1,1
13612,google io live stream pixel 3a new google home and more could be unveiled today,1,1,1
993,google play has 98 percent fewer apps that require call and sms permissions company says 91 mobiles just now,1,1,1
2492,"Lea Salonga is supportive of the new ""Aladdin""",1,1,1
2536,Beauty Secrets We Learned From Yusef Williams,1,1,1
19136,amazon in need of drivers turns to its own employees,1,1,1
2133,amazon cuts price of samsung gear s3 frontier smartwatch below 200,1,1,1
8394,eco lodge set on the banks of the peruvian amazon jungle,1,1,1
26005,amazon slashes the price for corsair's hs70 wireless gaming headset,1,1,1
24695,google introduces bumper machine to make creating bumper ads easier,1,1,1
14141,pixel 3a pixel 3a xl android q and everything else to expect at google io 2019 today,1,1,1
25146,google extends pixel family with pixel 3a and 3a xl starting at rs 39999,1,1,1
20407,google is adding auto delete options to location and activity data,1,1,1
26139,google pixel 4 set for radical overhaul,1,1,1
2776,Major Hollywood studios may reconsider Georgia business over abortion law,1,1,1
24612,world's first 1tb microsd card is on amazon but you'll need to wait to get it,1,1,1
24747,google unveils new pixel handset starting at 399,1,1,1
307,Some YouTube Creators Worry They’ll Get the Steven Crowder Treatment With ‘Arbitrary’ Rules Enforcement,0,1,1
2614,Why I Don't Support Hysterectomies for Girls With Disabilities,1,1,1
12553,was google android recovery to record those updates,1,1,1
904,walmarts new tech chief comes from google microsoft and amazon,1,1,1
20533,amazon summer sale top deals on premium smartphones you may not want to miss,1,1,1
1580,50 inch hisense h50a6200uk 4k ultra hd smart tv with freeview play 2 year warranty u00c2u00a3299 delivered amazon,1,1,1
19888,amazon twenty succulents only 35 shipped great for mother's day,1,1,1
678,How to Pack for a Business Trip,1,1,1
1886,Pros and Cons of Amazon Prime,1,1,1
807,US STOCKS-Wall St gains on rate-cut hopes; tech leads rebound,0,0,0
25906,google consolidates home under nest brand and shows off a new hub,1,1,1
7510,how to watch the google io 2019 stream,1,1,1
13047,google express turns into google shopping for the shopaholics ani news just now,1,1,1
18908,for the first time amazon faces an enormous slate of shareholder proposals,0,1,1
6630,amazon is selling a diy backyard guest house,1,1,1
1176,President Trump talks trade deal at meeting with business executives after arriving in Japan,0,1,1
13039,amazon just dropped tons of new summer products and these 42 items blew us away,1,1,1
6518,the 8 things you'll learn after moving out of your parents' house what nonmuslims should know about ramadan if you're the eldest sibling you know these things are true treat yourself right and make 2019 'your' year how google is helping fillennials land their dream job the 8 kinds of wedding hashtags it's world penguin day and we're blessing your timeline with photos and videos of the cutest penguins these terrifying facts about global warming are why we should be worried about our planet's future,1,1,1
2970,"What's Next for 'Game of Thrones"" Cast Members",1,1,1
7894,google translate bug breaks instant text translation w camera company investigating,1,1,1
6989,independent local election candidate baffled and infuriated at the mysterious disappearanceof election billboard facebook twitter google,0,0,0
25844,google search will let you autodelete your activity logs in latest update & social barrel,1,1,1
13951,5 best seller gadgets on amazon you still want to buy in 2019 inventions world,1,1,1
2429,"How to make delicious harissa falafels with spiced beetroot, kefir dressing and pittas",1,1,1
3645,Tanak and Toyota roar through Portuguese dust,1,1,1
13407,google rolls out dark mode to more g suite apps,1,1,1
13394,google targets premium smartphone market with a 399 price tag for pixel 3a,1,1,1
1184,working document of synod on the panamazon region approved,1,1,1
229,Netflix Takes Near TKO In Exec Poaching Suit With Fox &amp; Disney; Could Signal Beginning Of The End Of Legal War,0,1,1
20583,oneplus 7 pro prebooking starts today on amazon,1,1,1
620,How to watch Afcon 2019 matches in Nigeria,1,1,1
2938,This man won million-dollar lotteries twice—now his wife has won $1 million too,1,1,1
12717,no stopping amazon in ny,1,1,1
26385,industrial logistics properties flying below the radar with amazon as its largest tenant,1,1,1
13401,making it easier to shop across google,1,1,1
255,Here is the 28th Most Popular Stock Among Hedge Funds,0,0,0
25308,how to enable dark mode on google chrome for windows 10,1,1,1
24480,google doodle honors pioneering inventor of ekg willem einthoven,1,1,1
1687,Amazon just got FAA approval to fly drones for deliveries,1,1,1
1120,seattle crane collapse student among four killed at new google campus in us city,1,1,1
1676,This Is Amazon's New Hexagonal Drone,1,1,1
13665,amazon prime video uk acquires star trekpicard series tvwise,1,1,1
1301,An insider's guide to the Le Mans 24hours: how to experience the ultimate endurance race in style,0,1,1
458,The Buffalo Hunt' seeks to show tribe in a new light,1,1,1
1632,Moving Average Crossover Alert: Micron Technology,1,1,1
25293,amazon founders exwife mackenzie bezos pledges half her fortune to charity,1,1,1
25849,details of minnesotas amazon hq2 proposal released,1,1,1
2276,What will it take to elect more female veterans to Congress?,1,1,1
19272,massive growth report on organic feed additives market 20192025 with major key player evonik industries archer daniels midland cargill chr hansen adisseo basf invivo nsa & more,0,1,0
25951,amazon india u00e2u0080u0094 warranty claim,1,1,1
1703,19 beach reads you'll want to read this summer u00e2u0080u0094 according to editors at amazon goodreads and book of the month,1,1,1
25549,amazon offers its workers 10000 to quit their jobs and start delivery business,1,1,1
2117,amazon says atampt accenture and nestle are all using its blockchain tools,1,1,1
1531,Paul Singer's Elliott Management Sets Date With Barnes &amp; Noble,1,1,1
18988,buffett's berkshire pegs its amazon wager at 8606 million,1,1,1
19734,phocuswire digest online travel lures amazon startup focus on frontdesk,1,1,1
1926,google pixel 3a vs oneplus 6t price,1,1,1
3751,"Major automakers back compromise on U.S. vehicle emissions rules, urge deal",1,0,1
12785,google duplex calls for reservations are handled by humans onefourth of the time,1,1,1
19661,google is tweaking the play store's app rating system to favor recent reviews,1,1,1
2877,I Go to Disneyland Religiously—Here Are the 6 Shoes That Never Give Me Blisters,1,1,1
2723,Reuters Entertainment News Summary,1,1,1
1803,what to expect at google io 2019 midrange pixel 3a and 3a xl nest hub max a 10inch smart display with a nest camera android q updates and more kyle wiggersventurebeat,1,1,1
1253,ic media direct & present at adtech in san francisco to reveal advanced solutions for google reputation management,1,1,1
24711,sonos to add google assistant,1,1,1
12562,a bass upgrade to your echo speakers amazon echo sub review,1,1,1
19611,10pack fruit of the loom mens pocket tees assorted earth tones 22 free samph w amazon prime,1,1,1
3697,Alice Cooper Plots Headlining Fall North American Tour,1,0,1
2274,airtel launches rs 299 prepaid recharge plan that offers free amazon prime membership,1,1,1
25256,amazon walmarts flipkart may avoid key queries in cci study to protect trade secrets,1,1,1
176,Financial Guru Warren Buffett's Favorite Financial Stocks,0,0,0
8044,tech xtr google assists android users free storage space,1,1,1
7618,gerber's serrated remix tactical knife is down to a new alltime low at amazon 1350 reg 30,1,1,1
26245,philips juicers garmin smart scales amazon devices xbox live memberships and more on sale for may 21 in the uk,1,1,1
731,google facebook were committed to transparency attribution no so much,1,1,1
24637,this sunscreen just earned a perfect score from consumer reports for the fifth time u00e2u0080u0094 and its on amazon,1,1,1
20546,google apologises for saving some g suite passwords in plain text for over a decade,1,1,1
2885,Bill De Blasio’s Not Running for President. He’s Running for Profit.,1,1,1
7159,its not just google banks are chasing kotlin developers too,1,1,1
1896,"A Week In Austin, TX, On A Joint $164,000 Income",1,1,1
3370,FCA Withdraws Proposed Offer for a Merger with Renault,1,1,1
7928,amazon denies supplier purge but vendors wise to prep in case,1,1,1
19572,how google helped unpack the stress from modern travel,1,1,1
1515,amazon owner reveals spaceship & plans to put humans on the moon,1,1,1
26392,crownhill packaging joins the amazon packaging support and supplier network apass,1,1,1
7007,google tracks nearly all your online and some of your offline purchases u00e2u0080u0094 see it for yourself here,1,1,1
24605,when is amazon prime day the essential guide to amazon's gigantic sale,1,1,1
25967,amazon canada gtracing gaming chair racing 099red lightning deal 16999 no tax,1,1,1
20517,prasar bharati joins hands with google for lok sabha election 2019 results live streaming,1,1,1
665,research analysts' weekly ratings changes for evonik industries evk,1,1,1
979,daily crunch google play rethinks app ratings,1,1,1
19696,recent research context aware computing cac market growing at high cagr by 2025 amazoncom inc the us apple inc the us intel corporation the us samsung incsouth korea google inc the us microsoft the us baidu china etc,0,0,0
13153,amazon takes stake in deliveroo as it challenges uber in food delivery,1,1,1
13042,nokia 71 vs google pixel 3a specs price comparison,1,1,1
14298,amazon discounts anthem to below 30 and the division 2 to under 45,1,1,1
13507,amazon primes 1day shipping upends retail again,1,1,1
25508,what will google call its new android 10 q software,1,1,1
711,Filming on Julian Fellowes's New Period Drama 'Belgravia' Will Begin This Summer in Scotland,1,1,1
1692,former google ceo eric schmidt to leave alphabets board after 18 years,1,1,1
19377,toilet seats with picture sof hindu god on it lands amazon com in trouble,1,1,1
7723,how to set up any google home googles versatile smart speaker in just a few minutes,1,1,1
1455,this is the new google pixel photo,1,1,1
656,after bear repellent incident amazon plans to store some hazardous products at specialised warehouses,1,1,1
8270,google pixel 3a xl sony wireless noise cancelling headphones and more for may 18,1,1,1
977,Love Island viewers are left baffled by Curtis Pritchard's sex confession,0,1,1
1404,update sound events copy & save google releases live transcribe and sound amplifier apps to improve android for the hearingimpaired,1,1,1
12482,vietnamese phone owners anxious as google cuts huawei ties,1,1,1
7208,amazon shareholder meeting resolutions but no change,0,1,1
2261,Private jetsetters name Restaurant de l'Hôtel de Ville world's best restaurant,1,1,1
2572,Love Island review: The Joe-Tommy-Lucie relationship has become a horrific Goodnight Sweetheart...,1,1,1
6649,google employees facing retaliation organize worldwide sitin,1,1,1
172,5 Top Dow Stock Gainers of Past Month Still Holding Momentum,0,0,0
2011,"Smith &amp; Nephew (SNN) Buys Brainlab, Braces Robotic Ecosystem",1,1,1
2098,New York City Cracks Down on Ice Cream Trucks With ‘Operation Meltdown’,1,1,1
7064,3 muslim workers at amazon file federal discrimination complaint,1,1,1
514,google maps will make it easier to visit cities,1,1,1
12560,google assistant can now control gs smart microwaves engadget,1,1,1
12891,financial architects has lifted amazon com amzn position by 524198 yandex n v yndx stake held by hound partners llc,1,1,1
3071,12 best eco-friendly toys that worth investing in,1,1,1
26394,google removes 100 android apps with a total of 600 million downloads & nauch,1,1,1
1842,"At Amazon’s re:MARS fest, Iron Man actor Robert Downey Jr. unveils campaign to clean up the planet",1,0,1
26348,technology google adds way to autodelete your location history web activity,1,1,1
13008,amazon to support stem education,1,1,1
19368,what's new on amazon prime video in june 'absentia yardie the spy who dumped me' and more,1,1,1
19982,sugarcrm releases salesfusion for google ads,1,1,1
18515,facebook ftc investigation delay while google abandons huawei,0,1,1
3800,Toyota sharply criticizes Trump designation on auto imports,1,1,1
2118,Google Maps adds disaster alerts following Apple's Maps app debut,1,1,1
8104,amazon india u00e2u0080u0094 wrost,1,1,1
20168,with the official us launch of the google pixel 3a and pixel 3a xl set for may 7 during google io 2019 we are merely days away we were expecting an indian launch for the midrange handsets and thanks to online retailer,1,1,1
7801,entertainment 'the tick' canceled by amazon after two seasons,1,1,1
24708,google lens can tell diners what to order at restaurants,1,1,1
