,headline,actual_classification,logistic_regression_classification,xgboost_classification
2057,Merit Medical Systems Sees Hammer Chart Pattern: Time to Buy?,1,1,1
647,amazon is opening a new dangerousgoods warehouse after dozens of fulfillmentcenter workers were injured by bearspray fumes in december,1,1,1
13132,underwriting by google' leads to wrong answers on autism drivers,1,1,1
7294,google doodle celebrates lucy wills whose work changed prenatal care for women forever,1,1,1
1713,what to pay attention to in google search console,1,1,1
1966,amazon opens preorders for boruto naruto next generations bluray set 2,1,1,1
1621,why look forward to prime day amazon hearth tv gadgets are on sale now & newpaper24,1,1,1
3115,The next Star Wars film will come from Game of Thrones showrunners,1,1,1
25971,sc seeks centre's reply on plea to regulate netflix amazon prime video content,1,1,1
1384,google confirms it will automatically delete users data,1,1,1
1028,Silicon Valley Is Targeted by U.S. Over Antitrust,0,0,1
3262,"YouTube Confuses Everyone, Satisfies Nobody With Half-Measure Against Homophobe Steven Crowder",1,1,1
20382,mobile advertising market thriving worldwide with top key players applovin corporation avazu inc chartboost inc flurry inc google inc,0,0,0
1558,nextlevel picking picavi uses the new glass enterprise edition 2 from google,1,1,1
749,indigenous chief raoni goes to europe in defense of amazon,1,1,1
25973,philadelphia mayor seeks 2nd term touting soda tax benefits unlimited digital access only 099 for your first month huawei us controls have 'no impact' talking to google,1,1,1
18712,deep learning market share is expected to hold dominance over 2027 key players are google microsoft ibm corporation facebook qualcomm technologies nvidia amazoncom intel corporation,0,0,0
1812,new research on mobile advertising industry 20192026 market insights size share trend types and top key players applovin flurry inmobi google twitter,0,0,0
7724,garmins fenix 5 gps watch is on sale for 150 off u00e2u0080u0094 its lowest price ever on amazon,1,1,1
19354,google to crack down on deceptive ads from antiabortion clinics,1,1,1
24796,google unveils new digital ad formats,1,1,1
3169,Taika Waititi’s Hitler Satire ‘Jojo Rabbit’ Lands Fall Release Date,1,1,1
7575,amazon prime mother's day gifts under 100 affordable thoughtful gifts,1,1,1
372,The EV Truck Race Is a Real Problem for Investors Considering GM Stock,0,0,0
90,Top Ranked Momentum Stocks to Buy for June 5th,0,0,0
332,U.S. House panel to probe competition in digital markets,0,0,1
14306,amazon working on device to read human emotions,1,1,1
8321,amazon comes up with an offer for workers says will pay for your resignation help start business,1,1,1
6604,google's most interesting io announcement was a totally ungoogle move & new york magazine,1,1,1
19149,walmart blows amazon out of the water with its own free nextday delivery,1,1,1
6636,the update of google lens with food service and translations is being developed & droid life,1,1,1
137,Snap (SNAP) in Focus: Stock Moves 6.8% Higher,0,0,0
6727,tech news & chromiumbased edge error with google docs & a cautionary sign of things to come,1,1,1
8323,healthcare cognitive computing market to witness massive growth ibm google microsoft palantir,0,0,0
20148,researchers from seoul national university of science and technology report recent findings in fluctuation and noise forecasting the volatility of stock market index using the hybrid models with google domestic trends,0,0,0
2729,Google Requires Loot Box-Laden Kids' Games Disclose the Odds of Winning Digital Goods,1,1,1
963,This Woman Recreated The Perfect Baby Photoshoot – With Her PhD Thesis,0,1,1
24926,ikeas new app has a feature to rival amazon target and wayfair,0,1,1
19347,cricket world cup 2019 google doodle colourful and animated doodle marks the beginning of icc cwc19 in england and wales latestly just now,1,1,1
3272,Huawei denies report that orders to key suppliers cut after U.S. blacklisting,1,1,1
25651,brazil amnesty international warns of increased violence in territorial conflicts in the amazon due to land seizures and logging,1,1,1
1314,google suchvorschlu00c3u00a4ge's finest,1,1,1
3702,The Capital Of Tomorrow: How Tokyo Is Upping Its Game,1,1,1
13304,android alert & this nice google characteristic might quickly be scrapped & newpaper24,1,1,1
13449,irish data protection commission examines google data practices,1,1,1
1346,Tuesday Sports in Brief,0,1,1
1985,Elmer Bernstein’s iconic Ghostbusters score released online for the first time ever: Stream,1,1,1
6798,exhaustive study on trimethylolpropane trimethacrylate market 2019 strategic assessment by top players basf arkema evonik etc,0,0,1
13929,automation may claim 1300 jobs at amazon warehouses in the us report,1,1,1
20512,google earnings transparency issue sparks analyst backlash,1,1,1
2443,"U.S. probe of Google's online ad dominance would appease long suffering rivals, publishers",1,1,1
1304,A 35-Year-Old Yoga Instructor Disappeared While Hiking In Hawaii,0,1,1
8250,google expands in new york amid talent shortage in silicon valley,1,1,1
8194,ai outperforms radiologists in lung cancer hunt & google looking to commercialise model,1,1,1
1960,Celebrate National Doughnut Day with Cincinnati's best doughnut shops,1,1,1
18850,who was willem einthoven google celebrates inventor of the ecg with doodle,1,1,1
20366,google really honors memorial day for the first time,1,1,1
3885,Google’s Shadow Work Force: Temps Who Outnumber Full-Time Employees,1,1,1
24645,google plans new browser tools on privacy ad transparency this article published by,1,1,1
19690,amazon contributing 3m to seattle u's center for science and innovation to expand stem reach may 13 2019,1,1,1
18762,3d printing plastics market study with competitive landscape market insights & forecast dowdupont evonik industries hp sabic,0,0,1
6723,zinus king memory foam mattress only 200 shipped at amazon,1,1,1
7258,womans 4x4 broken into as she tended grannys grave in kilcullen facebook twitter google,0,1,1
24686,published 7th may 2019 vapor io links to aws at the edge & operators need to do the same the biggest question facing operators as they devise their strategies for edge computing is whether the cloud giants will be competitors or partners in the centralize cloud the scale of amazon aws and microsoft azure is hard to beat but as the cloud is distributed to evermore dispersed locations the distributed nature of a telco's network and sites mean it has more to bring to the table an operator might partner with aws or azure providing locations and high quality connectivity while the cloud company brings its services and brand as services become more personalized and differentiated the operator might increase its place in the value chain by supporting network slicing from data center to edge those slices might callu00e2u0080u00a6 please login for full access to wireless watch articles or sign up for a free trial edition register by caroline gabriel share this 0 like,0,0,0
13146,at amazon captains of crush hand gripper & sport plus fairwin tactical rigger belt nylon we,1,1,1
2596,The Best High-End Hotel Rooms on the Planet,1,1,1
3168,The 2 Code Words You Never Want to Hear in Disney Parks,1,1,1
6934,amazon to let alexa users delete voice commands in privacy push,1,1,1
25061,huduma namba sportpesa kakamega 'twins' top google searches,1,1,1
6764,anker roav bolt is like a buggy google home for your car & android police,1,1,1
2049,berkshire hathaway finally bought shares of amazon says warren buffett,0,1,1
3129,Fox 2019-2020 Primetime Schedule and New Series,1,1,1
6469,apples official iphone docks are discounted on amazon,1,1,1
2365,Grammy Award-Winning Jazz Drummer Lawrence Leathers Found Dead at 37 in Building Stairwell,1,1,1
14021,amazing launch deal claim a free acer chromebook worth u00c2u00a3199 when you order the new google pixel 3a or 3a xl pixel 3a unltd calls and text 3gb data & u00c2u00a326 pm u00c2u00a30 upfront 9gb data & u00c2u00a329 pm u00c2u00a30 upfront 15gb data & u00c2u00a334 pm u00c2u00a30 upfront 30gb data & u00c2u00a337 pm u00c2u00a30 upfront available in just black purpleish & clearly white easily keep your number and switch networks full info below the deals section on our website have a question write it below w,1,1,1
2606,"How Adidas, Keds and Chooze Are Empowering Young Girls",1,1,1
25547,apple amazon google and others sued for selling thousands of pirated recordings,0,1,1
581,google new ai translation tool lets you use your own voice,1,1,1
7491,pharmacy among industries amazon could disrupt,1,1,1
12627,examazon alexa exec lays out controls vision of an operating system for smart homes,1,1,1
545,UPDATE 2-G20 agrees to push ahead with digital tax -communique,1,1,1
14145,google says titan security keys could be hacked offers free replacement fossbytes just now,1,1,1
1473,3 amazon seller frustrations set to hinder their business,1,1,1
19386,challenging amazon walmart unveils oneday delivery on more than 200k items,1,1,1
665,Cramer Says He Understands The Case For Breaking Up Big Tech,1,1,1
3797,BMW CEO Future in Doubt as Tensions Erupt on Tackling Shift,1,1,1
1494,free amazon echo deal ends this week and heres 14 new things to ask alexa,1,1,1
6714,this weeks top stories assistant 'light bar google drive & photos to stop syncing more,1,1,1
2195,You might have missed the most promising new feature of iOS 13,1,1,1
705,"It’s folly to break up Amazon, Apple and Google",0,1,1
7010,google expected to unveil updated smart assistant software alongside 64gb versions of the pixel 3a and pixel 3a xl costing 399 and 479 at the firms annual conference,1,1,1
3248,Metallica perform National Anthem at NBA Finals Game 3: Watch,1,1,1
13060,loyalty schemes help retailers combat amazon,1,1,1
19219,garmin speak with amazon alexa is 50 off right now,1,1,1
25124,google reveals why its important to have your phone number,1,1,1
2474,‘Aladdin’ to Fly Past $500 Million at Global Box Office in 15 Days,1,1,1
19257,google proprietor alphabet misses gross sales forecasts,0,1,1
18691,chrome google can block ad tracking in the future & therestandardat,1,1,1
8184,payment processing market is booming worldwide paypal stripe amazon payments,1,1,1
13126,amazon shrinks echo show with new 90 55inch model,1,1,1
3755,"Preliminary entry lists for Cup, Xfinity at Pocono",1,1,1
24733,google vs huawei hits millions of smartphone users,1,1,1
14252,rapper icet says he almost shot an amazon delivery driver,1,1,1
1242,centre's reply on plea to regulate netflix amazon content sought,1,1,1
14281,amazon wants to turn employees into independent couriers,1,1,1
7623,windshield repair kits amazon ebay etcany good,1,1,1
3342,Massive Google Outage Turned Smart Homes Into Zombies,1,1,1
947,Government Minister Wants To Shift Cargo From Trucks To Rail,0,1,1
3748,Speedy Byron wins Pocono 400 pole,1,1,1
1607,google pixel 3a delivery of the beta 3 of android q stopped for the time being,1,1,1
640,"G20 to tackle US-China trade war, digital tax",0,1,1
19703,breaking ruby walsh retires after winning gold cup at punchestown facebook twitter google,0,0,0
7048,la manera sencilla the organizer via the web version of the google trips,1,1,1
2298,amazon offers workers thousands to set up own delivery businesses,1,1,1
12869,highlights from google io 2019,1,1,1
20694,google ceo sundar pichai blames a drop in sales of its pixel smartphone on headwindsthat are putting pressure on every expensive phone msn just now,1,1,1
1202,google maps declares war on speed cameras,1,1,1
2317,Developers sue Apple over app store fees,1,1,1
525,amazon helps employees start their own package delivery business,1,1,1
1657,amazon fired 7 pregnant warehouse workers who then sued the 359 ep 555,1,1,1
793,google officially launches pixel 3a and pixel 3a xl priced from 399,1,1,1
978,global businesstobusiness market top key players are ibmamazonhclaxwayoraclehybris softwarephoenix biz solutionnetalogue technology plctechdinamics,0,1,0
1649,Amazon drone deliveries to begin 'in months',1,1,1
25090,top smartphones to be launched in the month of may google might launch pixel 3a xl,1,1,1
25487,wwf teams up with old mout to protect amazon rainforest,1,1,1
12741,amazon is getting closer to building an alexa wearable that knows when youre depressed,1,1,1
2578,Everything Nick Jonas Has Said About His Political Aspirations and Running for President,1,1,1
2686,"Tina Knowles Says New ""Lion King"" Is ""on Steroids""",1,1,1
25674,hp inc continues amazon partnership with amazonae,1,1,1
25542,amazon employees personally deliver big donation to the woodbridge animal shelter and then got to play with the pets,1,1,1
24866,amazon echo show 5 presented with bright alarm and camera cover & therestandardat,1,1,1
1126,Top 5 Things to Know in The Market on Tuesday,0,1,0
20281,huge list of amazon codes may 10th,1,1,1
1679,entertainment icet says he almost shotan amazon delivery driver forcreeping up to his home,1,1,1
20619,client note another 1b softbank round facebook & amazon announce p2p payments ethereum bonds 7b for rpa and more may 01,0,0,1
3747,National Soccer Hall of Fame Voting Remains a Grossly Flawed Process,1,1,1
18932,google duo now supports group calling and data saving mode,1,1,1
14431,what cycling 4000 kilometers along the transamazonica tells us about the state of the amazon,1,1,1
13505,no surprise that amazon is using blockchain as a service baas,1,1,1
1101,amazon amzn stock should you be concerned about missed earnings,1,0,0
890,"E3 2019: Bethesda's June 9 Showcase - how to watch, what to expect",0,1,1
1004,amazon launches 90 blink xt2 security camera,1,1,1
1909,multi cloud storage market worldwide industry growth demand and top key players ibm sap se microsoft gosun technology google vmware emc,0,0,0
14283,bet you can't solve this google interview question,1,1,1
6645,google announces google glass enterprise edition 2,1,1,1
12859,beaumont financial partners cut stake in mcdonalds mcd by 335061 as shares declined allen investment management position in amazon com amzn raised as market value rose,0,0,0
3727,"Martin Truex Jr., No. 19 team 'doing all the little things right'",1,1,1
25672,amazon upgrades fire 7 tablet with faster soc and double storage,1,1,1
25778,you can soon autodelete your google location tracking data,1,1,1
13916,why amazon and a league of exveterans are proving that military skills are good for business,1,1,1
19523,amazon explores ai machine learning and robotics at its innovation day 2019,1,1,1
3198,"Google unveils late 2019 launch date, price, games line-up for new gaming service",1,1,1
1171,Everything We Know About The Disappearance Of 4-Year-Old Maleah Davis,0,1,1
13422,google said the data is not used to serve ads,1,1,1
1573,Google Cloud Scoops Up Looker for $2.6 Billion,1,1,1
26354,understanding fulfillment by amazon in canada,1,1,1
26419,extracting results of kmeans using google earth engine,1,1,1
1832,"Bernie Sanders tells shareholders Walmart pays ""starvation wages""",1,1,1
26342,hanna on amazon prime cast who plays hanna on prime series who is esme creedmiles,1,1,1
6776,global virtual private servers vps market top player are amazon web services godaddy rackspace liquid web digitalocean ovh group dreamhost endurance international group united internet ag a2 hosting inmotion hosting plesk international tektonic vultr holdings corporation and linode,1,1,1
7386,amazon weighing pregnancy against productivity fired 7 expectant mothers the 359 ep 555 cnet,1,1,1
7923,google's pixel 3a and 3a xl now available from amazon,1,1,1
24614,connected cars market future growth prospect and trends to 2025 by top key players google tesla audi ag bmw ag volvo car corporation robert bosch gmbh delphi automotive,0,0,0
12625,amazon close to acquire sizmeks adserving technology bloomberg says,1,1,1
25793,google io 2019 date and keynote predictions & techradar,1,1,1
2780,Disney CEO says it will be 'difficult' to film in Georgia if abortion law takes effect,1,1,1
18711,which tech giant do you trust how google apple facebook and microsoft are doing privacy,0,0,0
7353,google is testing miniapps in search and google assistant & venturebeat,1,1,1
20602,intex inflatable swan rideon just 11 at amazon regularly 20,1,1,1
2998,The Most Affordable Downtowns To Live In Across America,1,1,1
3631,The EV Truck Race Is a Real Problem for Investors Considering GM Stock,1,0,0
3149,First trailer for 'Maleficent: Mistress of Evil' pits Angelina Jolie against Michelle Pfeiffer: Watch,1,1,1
1098,Edited Transcript of 4021.T earnings conference call or presentation 15-May-19 6:15am GMT,0,0,0
12949,daily news roundup google kills the project to bring windows to chromebooks,1,1,1
407,Dow Jones Industrial Average Slides as Treasuries Fuel Recession Fears,0,0,1
14411,google duo rolls out group video calls datasav,1,1,1
8120,here's how google pixel 3a and 4 are taking a cue from oneplus,1,1,1
25371,amazon japan reportedly stops selling huawei devices,1,1,1
1066,google honours lucy wills who gave birth to folic acid,1,1,1
8047,aditi rao hydari on why she doesn t google herself anymore,1,1,1
574,google automobile with donuts,1,1,1
14434,kildare cycling club pays tribute to tragic cyclist who lost his life facebook twitter google,0,0,0
7924,one stock that could be like buying amazon for 319,1,1,0
873,listen to all of tribegoals' episodes on spotify apple podcast google podcast and more listen to all of tribegoals' episodes on spotify apple podcast google podcast and more,0,1,1
2576,Disneyland's 'Star Wars' park launches new menu of treats,1,1,1
25072,cboe global markets google pixel 3a and google pixel 3a xl will be available from sprint beginning wednesday may 8,1,1,1
2496,"Secret Life Of Pets 2’ Seeing $47M+, But ‘Dark Phoenix’ Up In Smoke With $36M+ In Lowest Opening For ‘X-Men’ Movie",1,1,1
2303,complete growth overview on enterprise lbs market in 20192025 including top key players apple google here etc,0,0,0
25122,base oil market outlook and future growth during the forecast period 20192027 key players include bp plc chevron corporation ergon inc evonik industries ag exxon mobil,1,0,0
12464,companionlink for google outlook sync updated for multiple shared google calendars,1,1,1
13826,analyst google assistant could boost sonos speaker sales,1,1,1
3005,Guardians' director James Gunn calls 'Brightburn' a 'great help to me' after Disney firing,1,1,1
2166,iTunes: Apple explains what is actually happening to your music,1,1,1
25513,global triethylene glycol dimethacrylate tegdma market insights & deao analysis 20192024 basf arkema evonik shinnakamura chemical geo igm,1,1,1
14358,soundesk is the lovechild of an amazon echo and a sleek designer table,1,1,1
2695,"Godzilla’ Loses Teeth With $49M Opening, But Counter-Programming Excels For First Time This Summer With ‘Rocketman’ &amp; ‘Ma’",1,0,1
1303,google glass refuses to die enterprise edition 2 gives it a new lease on life,1,1,1
3625,Nissan ex-chair Ghosn released from Japanese detention,1,1,1
536,whats coming to hulu amazon prime video and hbo in may 2019,1,1,1
18731,camera head to head lumia 950 xl vs google pixel 3a xl,1,1,1
18510,partner investment management lp increases position in humana hum amazon com amzn stake maintained by taurus asset management llc,0,1,1
3831,Review: The 2020 Toyota Supra was worth the long wait,1,1,1
14456,within google you can now order food without the need to use other apps,1,1,1
26283,google duo s group video calling now available globally on android ios,1,1,1
12749,warren buffetts billiondollar bet on amazon,1,1,1
14165,google spinoff lyft team up to offer selfdriving car,1,1,1
459,coleman wonderlake dome youth tent 4x7 1199 amazon,1,1,1
190,J.J. Abrams May Have Narrowed Down Field For Blockbuster Overall Deal,0,1,1
2791,Everything You Need to Know About Disneyland's Highly Anticipated 'Star Wars': Galaxy's Edge,1,1,1
13140,lawmakers applaud google for revoking huawei's android license,1,1,1
24892,how to fix google play store error 194 on samsung galaxy s9,1,1,1
505,"The Right Way to Wash Your Face (and Products to Never Use), According to a Top Dermatologist",1,1,1
1164,huawei us controls have 'no impact talking to google,1,1,1
14447,google pixel 4 image leaked punchhole selfie dualrear cameras no physical buttons and more details,1,1,1
7812,an immigrant with little english and big american dream amazon ceo jeff bezos shares fathers journey,1,1,1
24665,axios pro rata chicos and the lbo man u00e2u0080u0094 amazon buys into food delivery u00e2u0080u0094 luckin prices high,1,1,1
947,longtime european tv rivals forge alliances to battle threats from netflix amazon,1,1,1
1732,casey plett wins 60k amazon canada first novel award for little fish,1,1,1
19205,this service managed by amazon already allows companies to create blockchains criptonoticias,1,1,1
13201,model of the week bb8 google home ok google play imperial march,1,1,1
13813,google and apple deleted dating apps because they collected data from 12yearolds,1,1,1
2488,Everything we know about the X-Men’s future on screen now Dark Phoenix is done,1,1,1
14203,amazon tenavolts battery charger and 4 lithium rechargeable aa batteries just 1295,1,1,1
12646,amazon program offers employees 10k to start delivery service businesses,1,1,1
1715,Bernie Sanders tells Walmart shareholders company is paying workers 'starvation wages',1,1,1
2207,‘Game Of Thrones’ Jessica Henwick Joins Sofia Coppola’s ‘On The Rocks’,1,1,1
6734,evonik industries ag evkif ceo christian kullmann on q1 2019 results & earnings call transcript,1,0,1
595,"Sophie Turner Is the Reason the Jonas Brothers Reunited, According to Joe Jonas",1,1,1
18542,amazon technologies assigned patent for object ownership migration,1,1,1
14146,google needs to know everything about you before it can set your thermostat,1,1,1
3683,Stone Temple Pilots Announce ‘Purple’ Super Deluxe Edition,1,1,1
3560,Questions loom for Nissan with former chairman Ghosn gone,1,1,1
52,The Cloud Cannot Save Alibaba Stock from the US-China Trade War,0,0,0
19300,save big with amazon coupon codes may 22nd,1,1,1
19508,ideaya ipo at an early stage of development but google is a shareholder,0,1,1
7256,google play flooded by fake cryptocurrency & blockchain apps,1,1,1
19071,call for speed restrictions in athgarvan village to help stop road accidents facebook twitter google,0,1,0
2222,what would you name android q google says this oneshard,1,1,1
25493,amazon shareholders reject proposal to ban facial,1,1,1
20414,nice cat t shirt selling on amazonwith discount,1,1,1
12710,google says android now has 25b active devices compared to 2b it had in may 2017 frederic lardinoistechcrunch,1,1,1
1868,13 Real Ways to Make Money Without Leaving Home,1,1,1
14344,win a 20 amazon gc not by chance by j bliss romanticsuspense,1,1,1
1075,since its debut the only carrier that's had the privilege of selling the google pixel line has been verizon wireless that officially ends today though as google has partnered up with tmobile and sprint to bring the pixel 3 and the new pixel 3a to more customers on more networks,1,1,1
25386,thousands take part in darkness into light tomorrow facebook twitter google,0,0,0
24494,amazon mistakenly told sellers it was removing ads with religious content,1,1,1
1000,Inside the Secrets of Sand Hill Road: Term Sheet,0,1,1
13497,a lower close monday would saddle amazon with longest losing streak in 3 years,1,1,1
13158,amazon primed golden crossstock pattern forms israel moves amazon freight launches,1,1,1
2269,brownwood chamber and sbdc present google livestream workshop on may 8th,1,1,1
838,google doodle celebrates the life and legacy of eddie aikau,1,1,1
1796,Willis Towers Set to Grow on Rising Commissions and Fees,1,1,1
19212,google announces default mobilefirst indexing for new sites starting july 1 2019,1,1,1
20348,the investment chief at a 70 billion private equity behemoth explains how the rise of amazon and ub,1,1,1
14092,interview with daniel arbix general counsel of google brasil,1,1,1
26108,amazon leads 575 million investment round for food delivery company deliveroo & cnbc,1,1,1
25880,google says digital wellbeing not to blame for certain issues in pixel 3,1,1,1
1443,"﻿Global Matting Agents Market 2019 – Huntsman International, Evonik Industries, Baltimore Innovations, WR Grace – The Edge ",0,1,1
914,How Limited Series Play in the Past but Still Speak to Today’s Sensibilities,0,1,1
1090,amazon will send small vendors to its thirdparty marketplace marking a shift in strategy,0,1,1
7858,oppo showcases first 5g smartphone at google io 2019,1,1,1
6959,ar & vr smartglasses market 2019 by leading key players htc sony samsung google razer vuzix avegant flexel llc imprint energy inc,1,0,0
3492,"Nissan proposing more board members, with Renault's Bollore",1,1,1
18642,amazon leads 700 million investment into electric pickup truck startup rivian & venturebeat,1,1,1
18603,google to supersize 7 inch hub in 10 inch nest hub max,1,1,1
888,amazon web services sydney summit set to unveil the latest global technology trends,1,1,1
329,UPDATE 1-Alphabet shares slide 6% on possible DoJ antitrust probe,0,1,1
24632,global language translation software market key players 2019 alchemy proz kudoz mtec and google translate,1,1,0
26387,evonik q1 profit slips on startup costs,1,1,1
20649,brazilian giants comeback shows preservation and development of amazon is possible,1,1,1
26297,"google ceo accuses apple of selling privacy ""as a luxury good""",1,1,1
1502,"Amazon’s Black Friday deal on PlayStation Plus is back, and you’re crazy if you don’t re-up",1,1,1
18758,amazon is engaged on a wearable gadget that may learn human feelings knowhow information ettech,1,1,1
8097,global gift cards market growth analysis 2019 walmart amazon google play walgreens sephora,0,1,0
