,headline,actual_classification,logistic_regression_classification,xgboost_classification
1606,amazon devices sale plus deals on nintendo switch games and more for may 29 fire tv stick 4k streaming media player with alexa voice remote fire tv cube streaming media player bodyboss 20 home gym with one set of resistance bands up to 70 off quickbooks selfemployed memorial day sale ipad 97inch 32gb wifi tablet latest model apple airpods with charging case latest model insignia ns39df510na19 39inch 1080p smart led tv fire tv edition apple watch gps 40mm series 4 with black sport band fire tv stick with alexa voice remote nintendo switch console with bonus 25 walmart gift card instant pot duo plus 60 6quart 1000w electric pressure cooker tplink archer a7 ac1750 smart wifi router fire tv recast 500gb 75 hours fire tv recast 1tb 150 hours apple ipad pro 11inch wifi 64gb tablet latest model echo input tplink kasa smart wifi plug lite 2pack super smash bros ultimate nintendo switch,1,1,0
2067,TELUS to Invest $150M in Prince George to Boost Connectivity,1,1,1
3555,"Amber Alert for 4-year-old Texas girl Maleah Davis, allegedly abducted by 3 men: Cops",1,1,1
725,Mrs Hinch: Cleaning social media influencer under investigation by advertising watchdog,1,1,1
12630,bose adds google assistant voice control to speakers and soundbars,1,1,1
19701,google duplex to soon be made available for web,1,1,1
8063,google unveils nest hub max smart display with builtin camera for video chats and home security,1,1,1
14056,google assistant does not work offline,1,1,1
12908,eeoc letter alleges antimuslim discrimination at amazon facilities,1,1,1
495,Kate Spade's Husband Posts Heartbreaking Tribute on 1-Year Anniversary of Her Death,1,1,1
25388,amazon cancels the tick after only two seasons,1,1,1
14309,huawei p30 and p30 pro update brings dualview mode acer alcatel amazon apple archos asus amplicomms base benq siemens blackberry bq caterpillar coolpad dell doro eplus emporia fairphone fujitsu siemens garmin,0,1,1
1800,iphone killer pixel 3a could be cheapest google phone ever at u00c2u00a3399 & as 'may 7 launch' nears,1,1,1
2007,google home and amazon echo sale as both smart speakers receive dramatic price cuts,1,1,1
2202,Brazil retailer Via Varejo launches digital bank targeting low-income clients,1,1,1
1944,one of youtube's fastest growing markets is india google ceo sundar pichai,0,1,1
7561,document management software market analysis tech trends and forecasts report 2019 leading players are efile cabinet zoho xerox microsoft corporation google ascensio system sia so on,1,0,0
2008,Anthem (ANTM) Inks Deal to Acquire Beacon Health Options,1,1,1
2055,scam alert scammers add fake crypto wallet app imitating trezor on google play store,1,1,1
26100,our readers tell us what is wrong with the google pixel slate,1,1,1
24628,market snapshot dow futures rise on mcdonalds earnings tech under pressure after google results,0,0,0
7769,if chickfila is homophobic so are home depot walmart and amazon,0,1,1
25171,agriculture utility adjuvants market 2019 global industry overview 2025 top companies akzonobel nv croda international plc evonik industries ag helena chemical company etc,0,1,0
7252,win on wednesday & u00c2u00a310 amazon voucher,1,1,1
3429,Fiat-Renault's Failure Exposes Lots of Ugly Truths,1,1,1
7105,mobile water treatment services market swot analysis & technological innovation by leading industry experts dow basf albemarle evonik,1,1,1
2333,amazon says millions of custom alexa voice apps have come out of nocode skill blueprints program,1,1,1
3348,Apple's iOS 13: Here are all of the new features for your iPhone,1,1,1
20084,warren buffett's berkshire reveals 900 mn amazon stake,0,1,1
603,"The Zacks Analyst Blog Highlights: OptimizeRx, eHealth, Strategic Education, Hibbett Sports and...",0,0,1
1380,how to clear browser cache chrome 18338984927 google chrome not responding,1,1,1
8282,google set to release 2 smartphones,1,1,1
26256,the hampv news heatingcast 4 future of hvac the advent of the google boiler,1,1,1
12460,amazon alexa and google assistant in neck and neck fight for smart speaker leadership strategy,1,1,1
3059,Kevin Feige hints 'real' Mandarin could play a part in the future of the Marvel Cinematic Universe,1,1,1
7394,google signs deal with cuba to boost internet services,1,1,1
3346,Google to Hold First Ever Stadia Connect Livestream,1,1,1
3632,The 2019 Toyota RAV4 Hybrid Is the RAV4 to Have,1,1,1
463,G20 agrees to push ahead with digital tax: communique,1,1,1
509,rpm intl rpm stake has lifted by balyasny asset management llc financial advisory service has boosted position in amazon com amzn by 858572 as stock value rose,0,0,0
25969,google details translatotron its project to directly translate speech from one language into speech in another without intermediate text google ai blog,1,1,1
1561,‘Lucifer’ Renewed For Fifth &amp; Final Season By Netflix,1,1,1
20249,bernie sanders says its a disgrace that amazon and netflix pay nothing under trumps tax bill,1,1,1
13751,alphabet scoop 052 google io 2019 predictions & pixel 3a android q and more,1,1,1
3793,"Toyota, UTokyo and Trende to Test Blockchain-Based Electricity Trading System",1,1,1
13388,tech tuesday google removes apps and more,1,1,1
25545,amazon alibaba and nike among most valuable retail brands,1,1,1
24933,google pixel 3a day one availability in the uk ee carphone warehouse vodafone,1,1,1
3003,5 events worth checking out in Memphis this week,1,0,1
25952,augmented reality and virtual reality market 2019 global trend segmentation and opportunities forecast to 2025 key players like innovegatotal immersion vuzix corporation blippar oculus vr microsoft corporation google,1,0,0
3841,M-Sport Ford aims to poach Tanak from Toyota for 2020 WRC season,1,1,1
20221,jonas brothers documentary chasing happiness to launch on amazon prime video in june,1,1,1
1635,Neil Gaiman Deftly Turns Twitter Troll's Racist 'Good Omens' Rant Against Them,1,1,1
13992,10 reasons to consider switching your companys phone service to google voice,1,1,1
504,is google always right questioning the search giant,1,1,1
3153,Disney's Massive Cannibalization Opportunity,1,1,1
1491,google duplex is now just a fancy autocomplete,1,1,1
19247,not right google accused of 'leftwing bias' as study finds just 11 of 'top stories' are from rightleaning news sites,1,1,1
12917,shohei ohtani to return to angels hitting order daily life a struggle for most venezuelans can the use of ai weapons be banned where is the uk now on brexit amazon deal highlights ideological fissures within the democratic party newsline in depth newsline in depth newsline in depth newsline in depth newsline in depth newsline in depth,1,1,1
20615,netflix amazon prime video to be regulated sc seeks government's reply on plea,1,1,1
24587,amazon summer days sale discounts on xiaomi redmi 6 redmi 7 redmi y3 and more,1,1,1
3117,Data Sheet—Why the U.S.-China Trade War Won't Be Ending Anytime Soon,1,1,1
1759,Spirit (SAVE) Adds Several Services to Broaden Nashville Base,1,1,1
26469,why the google pixel 3a might be the best smartphone to buy right now,1,1,1
443,google says services on huawei phones still will function,1,1,1
1449,Hideki Matsuyama commits to play in 3M Open,0,1,1
24596,amazon return limitations,1,1,1
1579,"Jeff Bezos Has Never Meddled With Washington Post Coverage, Editor Marty Baron Affirms",1,1,1
6792,how to log outremove your account from google playstorephone device,1,1,1
1842,google play store gets support for cash payments upi coming soon,1,1,1
3060,Tessa Thompson Is the Superhero Hollywood Has Been Waiting For,1,1,1
19972,jalal baig from cancer cures to unproven therapies oncologists compete with dr google,1,1,1
13033,"vtech 28"" digital video baby monitor for 4994 shipped from amazon",1,1,1
2194,Silicon Valley Heads to Oakland for NBA Finals: Which Tech Giants Will Sit Courtside?,1,1,1
7563,health dept to put details of swine flu cases on google map,1,1,1
19415,google brings electronic ids to android,1,1,1
1888,netmarblessthe king of fighters allstar no 1 in popularity in the apples app store and google play,1,1,1
1033,cloud gis market to set phenomenal growth by 2023 google maps bing maps supermap zondy crber,0,1,1
24574,magnitude 80 earthquake strikes amazon jungle in peru,1,1,1
3218,"Yes, there’s actually an Alexa enabled Roomba you can afford",1,1,1
1751,is it necessary to invest in media coverage to improve your google rankings,1,1,1
8167,ministry of health partnership puts public hospitals on google maps,1,1,1
25867,global isobutene market report 2019 & lyondell basell tpc group exxon mobil nizhnekamskneftekhim enterprise products partners evonik yuhua group,0,1,1
722,dragontail vs gorilla glass & here's why google chose dragontail for its new pixel 3a,1,1,1
16,Author Who Went Viral for Allegedly Shaming a Woman Eating on a Train Sues Book Publisher for $13 Million,0,1,1
13663,you can get 8 pounds of straightup marshmallow cereal on amazon,1,1,1
24968,amazon may unleash longfeared purge of small suppliers,1,1,1
25228,google pixel 3a full features leaked ahead of official launch,1,1,1
2769,The Mysterious Note Walt Disney Left Behind Before He Died,1,1,1
664,amazon canada fluance fi20 bluetooth speaker 13396,1,1,1
20325,google introduces live caption and live relay for those with hearing disabilities,1,1,1
2218,consumer catchup igloo recalls coolers for suffocation risk new tariff threat could affect consumer electronics and toys and advocacy groups say amazon improperly collects data on children,1,1,1
12986,google duos group video calls roll out to everyone,1,1,1
